{
  "$schema": "./dataverse-mcp-policy.schema.json",
  "schemaVersion": 1,
  "serverName": "dataverse-mdcc",
  "connection": {
    "client": "github-copilot-vscode",
    "clientApplicationId": "aebc6443-996d-45c2-90f0-388ff96faa56",
    "transport": "http",
    "requiresAllowedClientRegistration": true,
    "endpointInput": "dataverse-mcp-endpoint",
    "customerEndpointMode": "vscode-runtime-input",
    "allowStaticCustomerEndpoints": false,
    "requiredScheme": "https",
    "allowedHostPatterns": [
      "^[a-z0-9-]+\\.crm(?:[0-9]+)?\\.dynamics\\.com$"
    ],
    "allowedPath": "/api/mcp",
    "previewAllowed": false,
    "authentication": "interactive-oauth-via-vscode-secure-store"
  },
  "codexConnection": {
    "transport": "stdio-microsoft-dataverse-proxy",
    "clientApplicationId": "0c412cc3-0dd6-449b-987f-05b053db9457",
    "customerEndpointMode": "user-local-config-only",
    "authentication": "interactive-oauth-via-windows-protected-cache",
    "profile": "diagnosis"
  },
  "credentialPolicy": {
    "allowSecretsInRepository": false,
    "allowSecretsInChat": false,
    "allowPlaintextEnvironmentFiles": false,
    "storage": "vscode-secure-input-and-oauth-store"
  },
  "identityPolicy": {
    "diagnosisAndRemediationMustUseSeparateIdentities": true,
    "remediationSessionDisabledByDefault": true,
    "verifyEffectiveRolesIncludingTeams": true
  },
  "profiles": {
    "diagnosis": {
      "allowedTools": [
        "search",
        "search_data",
        "read_query",
        "describe"
      ],
      "mutating": false
    },
    "remediation": {
      "allowedTools": [
        "search",
        "search_data",
        "read_query",
        "describe",
        "update_record"
      ],
      "mutating": true,
      "approval": {
        "required": true,
        "scope": "single-tool-call",
        "allowPersistentApproval": false,
        "productionRequiresEnterprisePolicy": true,
        "requireBeforeState": true,
        "requireAfterVerification": true
      }
    }
  },
  "deniedTools": [
    "create_record",
    "create_table",
    "update_table",
    "upsert_skill",
    "delete_record",
    "delete_table",
    "delete_skill",
    "init_file_upload",
    "commit_file_upload",
    "file_download"
  ],
  "audit": {
    "recordPlan": true,
    "recordApproval": true,
    "recordToolAndTarget": true,
    "recordBeforeAndAfterSummary": true,
    "recordSecretValues": false,
    "recordPersonalData": false
  },
  "localPresetConnection": {
    "catalogPath": "config/dataverse-mcp.local.json",
    "templatePath": "config/mcp.template.json",
    "runtimePath": ".vscode/mcp.json",
    "customerEndpointMode": "ignored-local-config-only",
    "profile": "diagnosis",
    "includeInPackage": false
  }
}
